platforms_mac,pc_requirements_recommended,price_overview_currency,linux_requirements_recommended,platforms_windows,required_age,header_image,pc_requirements_minimum,current_players,linux_requirements_minimum,is_free,price_overview_initial,steam_appid,price_overview_final,price_overview_discount_percent,coming_soon,recommendations_total,name,metacritic_score,platforms_linux,release_date,mac_requirements_recommended,metacritic_url,mac_requirements_minimum,developers,type,publishers
"true","Recommended:<br>&emsp;OS: Windows® 7, 64-bit<br>&emsp;Processor: 3GHz Quad Core<br>&emsp;Memory: 8 GB RAM<br>&emsp;Graphics: 2GB ATI Radeon HD 7970, 2GB NVIDIA GeForce GTX 770 or better<br>&emsp;Storage: 45 GB available space<br>&emsp;Sound Card: DirectX compatible sound card","GBP","Recommended:<br>&emsp;OS: Ubuntu 14.04.2 64-bit or Steam OS<br>&emsp;Processor: Intel i7 series<br>&emsp;Memory: 8 GB RAM<br>&emsp;Graphics: NVIDIA 960 (2GB)<br>&emsp;Storage: 45 GB available space<br>&emsp;Additional Notes:  &emsp; * Intel GPUs are not supported at time of release. &emsp; * We recommend Nvidia 358.16 drivers for best performance in XCOM 2. &emsp; * XCOM 2 War of the Chosen requirements differ to XCOM 2, please check the system requirements  here  before purchasing. ","true",0,"https://steamcdn-a.akamaihd.net/steam/apps/268500/header.jpg?t=1540241321","Minimum:<br>&emsp;OS: Windows® 7, 64-bit<br>&emsp;Processor: Intel Core 2 Duo E4700 2.6 GHz or AMD Phenom 9950 Quad Core 2.6 GHz<br>&emsp;Memory: 4 GB RAM<br>&emsp;Graphics: 1GB ATI Radeon HD 5770, 1GB NVIDIA GeForce GTX 460 or better<br>&emsp;DirectX: Version 11<br>&emsp;Storage: 45 GB available space<br>&emsp;Sound Card: DirectX compatible sound card<br>&emsp;Additional Notes: Initial installation requires one-time Internet connection for Steam authentication; software installations required (included with the game) include Steam Client, Microsoft Visual C++2012 and 2013 Runtime Libraries and Microsoft DirectX.",3715,"Minimum:<br>&emsp;OS: Ubuntu 14.04.2 64-bit or Steam OS<br>&emsp;Processor: Intel i3-3225 3.3ghz<br>&emsp;Memory: 4 GB RAM<br>&emsp;Graphics: NVIDIA 650 (1GB), AMD R9 270 (2GB) or better<br>&emsp;Storage: 45 GB available space<br>&emsp;Additional Notes:   &emsp; * Intel GPUs are not supported at time of release. &emsp; * Nvidia requires 352.55 or newer drivers. &emsp; * AMD requires Mesa 13.0.1 driver compiled using LLVM 3.9. &emsp; * XCOM 2 War of the Chosen requirements differ to XCOM 2, please check the system requirements  here  before purchasing. ","false",3499,268500,874,75,"false",20515,"XCOM® 2",88,"true","4 Feb, 2016",,"https://www.metacritic.com/game/pc/xcom-2?ftag=MCD-06-10aaa1f","Minimum:<br>&emsp;OS: macOS 10.11.6<br>&emsp;Processor: 2.4 GHz Intel Core i3<br>&emsp;Memory: 4 GB RAM<br>&emsp;Graphics: 1GB AMD 5750, Nvidia 650M, 1.5GB Intel Iris Pro 5200 (See Notes for more details)<br>&emsp;Storage: 45 GB available space<br>&emsp;Additional Notes: The game is supported on the following Macs. To check your Mac model and when it was released, select About This Mac from the Apple menu on your menu bar.  &emsp;*  All 13” MacBook Pros released since Late 2016 &emsp;*  All 15” MacBook Pros released since Early 2011 with a 1GB Graphics Cards and a 2.5GHz processor or better &emsp;*  All 17&quot; MacBook Pros since Early 2011 &emsp; * All 21.5” iMacs released since Late 2013 &emsp;*  All 27” iMacs released since Mid 2010 with a 1GB Graphics Card or better &emsp;*  All Mac Pros released since Late 2009 &emsp; Please note for your computer to meet the minimum requirements it must match or better all elements of the listed spec. For more detailed specifications check the Feral website. &emsp; ———  Multiplayer is compatible between Mac, Linux and Windows versions","Firaxis Games<br/>Feral Interactive (Mac)<br/>Feral Interactive (Linux)","game","2K<br/>Feral Interactive (Mac)<br/>Feral Interactive (Linux)"
"true","Recommended:<br>&emsp;Requires a 64-bit processor and operating system","GBP","Recommended:<br>&emsp;Requires a 64-bit processor and operating system","true",0,"https://steamcdn-a.akamaihd.net/steam/apps/457140/header.jpg?t=1540516081","Minimum:<br>&emsp;Requires a 64-bit processor and operating system<br>&emsp;OS: Windows 7 (64 bit)<br>&emsp;Processor: Dual Core 2 GHz<br>&emsp;Memory: 4 GB RAM<br>&emsp;Graphics: Intel HD 4600 (AMD or NVIDIA equivalent)<br>&emsp;DirectX: Version 11<br>&emsp;Storage: 2 GB available space",3716,"Minimum:<br>&emsp;Requires a 64-bit processor and operating system<br>&emsp;OS: Ubuntu 14.04<br>&emsp;Processor: Dual Core 2 GHz<br>&emsp;Memory: 4 GB RAM<br>&emsp;Graphics: Intel HD 4600 (AMD or NVIDIA equivalent)<br>&emsp;Storage: 2 GB available space","false",1899,457140,1424,25,"false",12175,"Oxygen Not Included",,"true","18 May, 2017","Recommended:<br>&emsp;Requires a 64-bit processor and operating system",,"Minimum:<br>&emsp;Requires a 64-bit processor and operating system<br>&emsp;OS: OSX 10.9<br>&emsp;Processor: Dual Core 2 GHz<br>&emsp;Memory: 4 GB RAM<br>&emsp;Graphics: Intel HD 4600 (AMD or NVIDIA equivalent)<br>&emsp;Storage: 2 GB available space","Klei Entertainment","game","Klei Entertainment"
"true","Recommended:<br>&emsp;OS: Windows 10 64 bit<br>&emsp;Processor: Intel Core i7-3770K<br>&emsp;Memory: 8 GB RAM<br>&emsp;Graphics: NVIDIA GTX 980Ti 2560x1440  or NVIDIA GTX 970 1920x1080<br>&emsp;DirectX: Version 11<br>&emsp;Storage: 25 GB available space","GBP","Recommended:<br>&emsp;OS: Ubuntu 17.10 <br>&emsp;Processor: Intel Core i7-3770K<br>&emsp;Memory: 12 GB RAM<br>&emsp;Graphics: Nvidia GTX 980Ti<br>&emsp;Storage: 28 GB available space<br>&emsp;Additional Notes:   &emsp;*    Requires Vulkan   &emsp;*    Nvidia graphics cards require driver version 396.24 or later. If you need to update your drivers, we recommend using the Proprietary GPU Drivers PPA.  &emsp;*    AMD graphics cards require Mesa 17.3.5 or later. If you need to update your drivers, we recommend using the Padoka Stable PPA.  &emsp;*    Vega graphics cards require Mesa 18.0 or later. &emsp;*    AMD GCN 1st and 2nd generation graphics cards are not supported. &emsp;*    Intel graphics cards are not supported. &emsp;*	Requires an SSE2 capable processor. ","true",18,"https://steamcdn-a.akamaihd.net/steam/apps/391220/header.jpg?t=1540399490","Minimum:<br>&emsp;OS: Windows 7 64bit<br>&emsp;Processor: Intel Core i3-2100 or AMD equivalent<br>&emsp;Memory: 6 GB RAM<br>&emsp;Graphics: NVIDIA GTX 650 2GB or AMD HD7770 2GB<br>&emsp;DirectX: Version 11<br>&emsp;Storage: 25 GB available space",4601,"Minimum:<br>&emsp;OS: Ubuntu 17.10 <br>&emsp;Processor: Intel Core i3-4130T or AMD equivalent<br>&emsp;Memory: 8 GB RAM<br>&emsp;Graphics: 2GB AMD R9 285 (GCN 3rd Gen and above), 2GB Nvidia GTX 680 or better<br>&emsp;Storage: 28 GB available space<br>&emsp;Additional Notes:   &emsp;*    Requires Vulkan   &emsp;*    Nvidia graphics cards require driver version 396.24 or later. If you need to update your drivers, we recommend using the Proprietary GPU Drivers PPA.  &emsp;*    AMD graphics cards require Mesa 17.3.5 or later. If you need to update your drivers, we recommend using the Padoka Stable PPA.  &emsp;*    Vega graphics cards require Mesa 18.0 or later. &emsp;*    AMD GCN 1st and 2nd generation graphics cards are not supported. &emsp;*    Intel graphics cards are not supported. &emsp;*	Requires an SSE2 capable processor. ","false",3999,391220,999,75,"false",31555,"Rise of the Tomb Raider™",86,"true","9 Feb, 2016",,"https://www.metacritic.com/game/pc/rise-of-the-tomb-raider?ftag=MCD-06-10aaa1f","Minimum:<br>&emsp;OS: Mac OS X 10.13.4<br>&emsp;Processor: 2.3GHz Intel Core i5 or better<br>&emsp;Memory: 8 GB RAM<br>&emsp;Graphics: 2GB Nvidia 680MX, 2GB AMD R9 M290, 1.5GB Intel Iris Graphics 540 or better (see notes for more details)<br>&emsp;Storage: 27 GB available space<br>&emsp;Additional Notes: The game is supported on the following Macs. To check your Mac model and when it was released, select About This Mac from the Apple menu on your menu bar.     &emsp;*    All 13&quot; MacBook Pros released since 2016 &emsp;*    All 15&quot; MacBook Pros released since Late 2013 with a 2.3GHz processor or better  &emsp;*    All 21.5&quot; iMacs released since 2017 &emsp;*    All 27&quot; iMacs released since Late 2013 (models with an Nvidia GT 755M graphics card are not officially supported) (1) &emsp;*    All Mac Pros released since Late 2013 &emsp; 1. Late 2012 models with a 2GB Nvidia 680MX graphics cards are also supported.   ——— The following Macs are capable of running the game but do not consistently meet the standards required for official support.   &emsp;*    All 15&quot; MacBook Pros released since Late 2013 &emsp;*    All 21.5&quot; iMacs released since Late 2013 with a 2.3GHz processor or better (models with an Nvidia 750M graphics card are not supported)  ——— Please note for your computer to meet the minimum requirements it must match or better all elements of the listed system requirements. For more detailed specifications check the Feral website.","Crystal Dynamics<br/>Eidos-Montréal<br/>Feral Interactive (Mac)<br/>Feral Interactive (Linux)<br/>Nixxes software","game","Square Enix<br/>Feral Interactive (Mac)<br/>Feral Interactive (Linux)"
"true","Recommended:<br>&emsp;OS: Windows XP or greater<br>&emsp;Processor: Intel Core Duo 2.0 GHz or AMD Athlon 64 X2 3600+<br>&emsp;Memory: 1GB RAM<br>&emsp;Graphics: NVIDIA GeForce FX 5200, ATI Radeon 9600, or better<br>&emsp;Hard Drive: 100MB available space<br>&emsp;Sound: Standard audio","GBP",,"true",0,"https://steamcdn-a.akamaihd.net/steam/apps/48700/header.jpg?t=1511540397","Minimum:<br>&emsp;OS: Windows® XP<br>&emsp;Processor: Intel Pentium 4 2.0 GHz or AMD 2.5 GHz<br>&emsp;Memory: 512MB RAM<br>&emsp;Graphics: 3D graphics card with 64MB RAM<br>&emsp;Hard Drive: 100 MB available space <br>&emsp;Sound: Standard audio",4092,"Minimum:<br>								&emsp;OS: Ubuntu 12.04 LTS, Steam OS<br>									&emsp;Processor: Intel Core Duo 2.0 GHz or AMD Athlon 64 X2 3600+<br>									&emsp;Memory: 1 GB RAM<br>									&emsp;Graphics: NVIDIA GeForce 6600GT / ATi Radeon 2400 or better<br>									&emsp;Hard Drive: 1 GB available space <br>									&emsp;Sound: Standard audio<br>								","false",1499,48700,599,60,"false",53792,"Mount & Blade: Warband",78,"true","31 Mar, 2010",,"https://www.metacritic.com/game/pc/mount-blade-warband?ftag=MCD-06-10aaa1f","Minimum:<br>								&emsp;OS: OS X version Mavericks 10.9, or later.<br>									&emsp;Processor: Intel Mac <br>									&emsp;Memory: 1 GB RAM<br>									&emsp;Graphics: NVIDIA GeForce 8600M / ATi Radeon 2400 or better<br>									&emsp;Hard Drive: 1 GB available space <br>									&emsp;Sound: Standard audio<br>								","TaleWorlds Entertainment","game","TaleWorlds Entertainment"
,,,,,,,,4664,,,,,,,,,,,,,,,,,,
"false","Recommended:<br>&emsp;Requires a 64-bit processor and operating system<br>&emsp;OS: Windows 7 64 bit / Windows 8 64 bit / Windows 10 64 bit<br>&emsp;Processor: Intel Quad Core i7 3770K or AMD Ryzen 7 1600X<br>&emsp;Memory: 8 GB RAM<br>&emsp;Graphics: nVidia GeForce GTX 780 Ti/970 (High settings) and 1070 (Ultra settings) or AMD R9 290/AMD RX480 (High settings)<br>&emsp;DirectX: Version 11<br>&emsp;Network: Broadband Internet connection<br>&emsp;Storage: 50 GB available space","GBP","Recommended:<br>&emsp;Requires a 64-bit processor and operating system","true",18,"https://steamcdn-a.akamaihd.net/steam/apps/440900/header.jpg?t=1539688358","Minimum:<br>&emsp;Requires a 64-bit processor and operating system<br>&emsp;OS: Windows 7 64 Bit/ Windows 8 64 Bit/ Windows 10 64 Bit<br>&emsp;Processor: Intel Quad Core i5-2300 or AMD FX-6300<br>&emsp;Memory: 6 GB RAM<br>&emsp;Graphics: Nvidia GeForce GTX 560 (1GB) or AMD Radeon HD 7770 (1GB)<br>&emsp;DirectX: Version 11<br>&emsp;Network: Broadband Internet connection<br>&emsp;Storage: 50 GB available space",3503,"Minimum:<br>&emsp;Requires a 64-bit processor and operating system","false",3399,440900,2039,40,"false",20986,"Conan Exiles",68,"false","8 May, 2018","Recommended:<br>&emsp;Requires a 64-bit processor and operating system","https://www.metacritic.com/game/pc/conan-exiles?ftag=MCD-06-10aaa1f","Minimum:<br>&emsp;Requires a 64-bit processor and operating system","Funcom","game","Funcom"
"true","Recommended:<br>&emsp;OS: Windows 8 / 7 / Vista / XP<br>&emsp;Processor: 2.4 GHz Quad Core 2.0 (or higher)<br>&emsp;Memory: 8 GB RAM<br>&emsp;Graphics: Intel HD Graphics 4000 and higher, ATI Radeon HD-Series 4650 and higher, Nvidia GeForce 2xx-Series and up<br>&emsp;Storage: 449 MB available space<br>&emsp;Sound Card: Yes","GBP","Recommended:<br>&emsp;Processor: 2.4 GHz Dual Core 2.0 (or higher)<br>&emsp;Memory: 8 GB RAM<br>&emsp;Graphics: Discreet video card<br>&emsp;Storage: 449 MB available space<br>&emsp;Sound Card: Yes","true",16,"https://steamcdn-a.akamaihd.net/steam/apps/250900/header.jpg?t=1487291293","Minimum:<br>&emsp;OS: XP<br>&emsp;Processor: Core 2 Duo<br>&emsp;Memory: 2 GB RAM<br>&emsp;Graphics: Discreet video card<br>&emsp;Storage: 449 MB available space<br>&emsp;Sound Card: Yes",4331,"Minimum:<br>&emsp;Processor: Core 2 Duo<br>&emsp;Memory: 2 GB RAM<br>&emsp;Graphics: Discreet video card<br>&emsp;Storage: 449 MB available space<br>&emsp;Sound Card: Yes","false",1099,250900,659,40,"false",58162,"The Binding of Isaac: Rebirth",,"true","4 Nov, 2014","Recommended:<br>&emsp;OS: 10.9<br>&emsp;Processor: 2.4 GHz Dual Core 2.0 (or higher)<br>&emsp;Memory: 8 GB RAM<br>&emsp;Graphics: Intel HD Graphics 4000 and higher, ATI Radeon HD-Series 4650 and higher, Nvidia GeForce 2xx-Series and up.<br>&emsp;Storage: 449 MB available space<br>&emsp;Sound Card: Yes",,"Minimum:<br>&emsp;OS: 10.8<br>&emsp;Processor: Core 2 Duo<br>&emsp;Memory: 2 GB RAM<br>&emsp;Graphics: Discreet video card<br>&emsp;Storage: 449 MB available space<br>&emsp;Sound Card: Yes","Nicalis, Inc.","game","Nicalis, Inc."
"true","Recommended:<br>&emsp;Requires a 64-bit processor and operating system<br>&emsp;OS: Windows 7 64-bit or newer<br>&emsp;Processor: Intel Core i7 CPU 920 @ 2.67GHz<br>&emsp;Memory: 8 GB RAM<br>&emsp;Graphics: ATI Radeon HD 5770 or NVIDIA GeForce GTX 960M<br>&emsp;Storage: 30 GB available space<br>&emsp;Sound Card: DirectX Compatible Sound Card","GBP","Recommended:<br>&emsp;Requires a 64-bit processor and operating system<br>&emsp;OS: Ubuntu 14.04 LTS 64-bit or newer<br>&emsp;Processor: Intel Core i7 CPU 920 @ 2.67GHz<br>&emsp;Memory: 8 GB RAM<br>&emsp;Graphics: ATI Radeon HD 5770 or NVIDIA GeForce GTX 960M<br>&emsp;Storage: 30 GB available space","true",0,"https://steamcdn-a.akamaihd.net/steam/apps/640820/header.jpg?t=1540491064","Minimum:<br>&emsp;Requires a 64-bit processor and operating system<br>&emsp;OS: Windows 7 64-bit or newer<br>&emsp;Processor: Intel Celeron 1037U @ 1.80GHz<br>&emsp;Memory: 4 GB RAM<br>&emsp;Graphics: Intel HD Graphics 3000<br>&emsp;Storage: 30 GB available space<br>&emsp;Sound Card: DirectX Compatible Sound Card",3298,"Minimum:<br>&emsp;Requires a 64-bit processor and operating system<br>&emsp;OS: Ubuntu 14.04 LTS 64-bit or newer<br>&emsp;Processor: Intel Celeron 1037U @ 1.80GHz<br>&emsp;Memory: 4 GB RAM<br>&emsp;Graphics: Intel HD Graphics 3000<br>&emsp;Storage: 30 GB available space","false",3499,640820,3499,0,"false",4128,"Pathfinder: Kingmaker",71,"true","25 Sep, 2018","Recommended:<br>&emsp;Requires a 64-bit processor and operating system<br>&emsp;OS: OS X El Capitan<br>&emsp;Processor: Intel Core i7-4770HQ @ 2.20GHz<br>&emsp;Memory: 8 GB RAM<br>&emsp;Graphics: Radeon HD 6790 or GeForce GTX 675MX<br>&emsp;Storage: 30 GB available space","https://www.metacritic.com/game/pc/pathfinder-kingmaker?ftag=MCD-06-10aaa1f","Minimum:<br>&emsp;Requires a 64-bit processor and operating system<br>&emsp;OS: OS X El Capitan<br>&emsp;Processor: Intel Core i7-3610QE @ 2.30GHz<br>&emsp;Memory: 4 GB RAM<br>&emsp;Graphics: Intel HD Graphics 4000<br>&emsp;Storage: 30 GB available space","Owlcat Games","game","Deep Silver"
"false","Recommended:<br>&emsp;OS: 64-bit: Vista, Win 7, Win 8<br>&emsp;Processor: Intel Core i5-750, 2.67 GHz / AMD Phenom II X4 965, 3.4 GHz<br>&emsp;Memory: 4 GB RAM<br>&emsp;Graphics: NVIDIA GeForce GTX 560 / AMD Radeon HD 6950 or better with 768 MB+ of VRAM (DirectX 11 Compatible)<br>&emsp;Network: Broadband Internet connection<br>&emsp;Storage: 10 GB available space<br>&emsp;Sound Card: DirectX compatible sound card",,,"true",0,"https://steamcdn-a.akamaihd.net/steam/apps/386360/header.jpg?t=1539823395","Minimum:<br>&emsp;OS: Windows XP SP2, Windows Vista or Windows 7<br>&emsp;Processor: Core 2 Duo 2.4 GHz or Althon X2 2.7 GHz<br>&emsp;Memory: 2 GB RAM<br>&emsp;Graphics: ATI or Nvidia graphics card with 512MB video ram or better and Shader Model 3.0+ support. (ATI Radeon 3870 or higher, Nvidia GeForce 8800 GT or higher)<br>&emsp;Storage: 10 GB available space<br>&emsp;Sound Card: DirectX compatible sound card",3201,,"true",,386360,,,"false",1279,"SMITE®",83,"false","8 Sep, 2015","Recommended:<br>&emsp;OS: OS X 10.10<br>&emsp;Processor: Intel Core i5-750, 2.67 GHz / AMD Phenom II X4 965, 3.4 GHz<br>&emsp;Memory: 4 GB RAM<br>&emsp;Graphics: NVIDIA GeForce GTX 560 / AMD Radeon HD 6950 or better with 768 MB+ of VRAM (DirectX 11 Compatible)<br>&emsp;Network: Broadband Internet connection<br>&emsp;Storage: 10 GB available space<br>&emsp;Sound Card: DirectX compatible sound card","https://www.metacritic.com/game/pc/smite?ftag=MCD-06-10aaa1f","Minimum:<br>&emsp;OS: OS X 10.10<br>&emsp;Processor: Core 2 Duo 2.4 GHz or Althon X2 2.7 GHz<br>&emsp;Memory: 2 GB RAM<br>&emsp;Graphics: ATI or Nvidia graphics card with 512MB video ram or better and Shader Model 3.0+ support. (ATI Radeon 3870 or higher, Nvidia GeForce 8800 GT or higher)<br>&emsp;Storage: 10 GB available space<br>&emsp;Sound Card: DirectX compatible sound card","Titan Forge Games","game","Hi-Rez Studios"
"true","Recommended:<br>&emsp;OS: Windows XP SP3/Vista/Win 7<br>	&emsp;Processor: 2.3 GHz Quad Core processor<br>	&emsp;Memory: 2 GB<br>	&emsp;Hard Disk Space: 20 GB free<br>	&emsp;Video Memory: 512MB<br>	&emsp;Video Card: NVIDIA GeForce GTX 560 / ATI Radeon HD 5850<br>	&emsp;Sound: DirectX 9.0c Compatible<br>	&emsp;Other Requirements:Initial installation requires one-time internet connection for Steam authentication; software installations required (included with the game) include Steam Client, DirectX 9, Microsoft .NET 4 Framework, Visual C++ Redistributable 2005, Visual C++ Redistributable 2008, Visual C++ Redistributable 2010, and AMD CPU Drivers (XP Only/AMD Only)","GBP",,"true",17,"https://steamcdn-a.akamaihd.net/steam/apps/49520/header.jpg?t=1536253880","Minimum:<br>&emsp;OS: Windows XP SP3<br>	&emsp;Processor: 2.4 GHz Dual Core Processor<br>	&emsp;Memory: 2 GB(XP)/ 2 GB(Vista)<br>	&emsp;Hard Disk Space: 13 GB free<br>	&emsp;Video Memory: 256 MB<br>	&emsp;Video Card: NVIDIA GeForce 8500 /ATI Radeon HD 2600<br>	&emsp;Sound: DirectX 9.0c Compatible<br>	&emsp;Other Requirements:Initial installation requires one-time internet connection for Steam authentication; software installations required (included with the game) include Steam Client, DirectX 9, Microsoft .NET 4 Framework, Visual C++ Redistributable 2005, Visual C++ Redistributable 2008, Visual C++ Redistributable 2010, and AMD CPU Drivers (XP Only/AMD Only)",3168,"Operating System: SteamOS, Ubuntu 14.04 <br>CPU Processor: Intel Core 2 Quad, AMD Phenom II X4<br>CPU Speed: 2.4GHz <br>Memory: 4 GB RAM <br>Hard Disk Space: 13 GB <br>Video Card (NVidia): Geforce 260<br>Video Memory (VRam): 1GB<br><br>IMPORTANT NOTICE: Don't meet the above requirements? That doesn't mean your configuration wont run Borderlands 2. Visit the Borderlands 2 community page to share your experience with other Linux players and learn about how to send bugs to Aspyr. Your feedback will help us improve Borderlands 2 Linux and future AAA Linux releases!<br><br>NOTICE:  Intel Integrated video chipsets and ATI chipsets are currently unsupported for Borderlands 2 Linux.<br>NOTICE:The Linux version is only available in English, French, Italian, German, and Spanish.<br>[/list]","false",1999,49520,1999,0,"false",85157,"Borderlands 2",89,"true","20 Sep, 2012","Recommended:<br>	&emsp;OS: 10.10.5 (Yosemite)<br>        &emsp;Processor: 2.2GHz Intel Quad Core<br>        &emsp;Memory: 4 GB RAM<br>	&emsp;Video Memory: 512 MB<br>        &emsp;Video Card: ATI Radeon HD 5750 / NVidia Geforce 650M / Intel HD 4000","https://www.metacritic.com/game/pc/borderlands-2?ftag=MCD-06-10aaa1f","Minimum:<br>&emsp;OS: 10.8.5 (Mountain Lion), 10.9.5 (Mavericks), 10.10.5 (Yosemite), 10.11.6 (El Capitan), 10.12 (Sierra) <br><br>	&emsp;Processor: 2.4 GHz Intel Core 2 Duo (Dual-Core)<br>	&emsp;Memory: 4 GB RAM<br>	&emsp;Hard Disk Space: 13 GB<br>	&emsp;Video Memory: 256 MB<br>	&emsp;Video Card: ATI Radeon HD 2600 / NVidia Geforce 8800/ Intel HD 3000<br>	&emsp;Additional: Macintosh mouse and keyboard. Borderlands 2 supports both the Xbox 360 wired gamepad AND the PlayStation 3 Dualshock 3 Wireless Controller 	<br>        &emsp;NOTICE: It is possible for Mac and PC to become out of sync during updates.  Within this short time period, Mac users will only be able to play other Mac users.        <br>        &emsp;NOTICE: This game is not supported on volumes formatted as Mac OS Extended (Case Sensitive)<br>        &emsp;NOTICE: The following video chipsets are unsupported for Borderlands 2: ATI RADEON HD 2400, NVIDIA 8600m, NVIDIA 9400m, 9600m, Intel Integrated GMA 950, Intel Integrated x3100<br><br>NOTICE:The Mac version is only available in English, French, Italian, German, and Spanish.","Gearbox Software<br/>Aspyr (Mac)<br/>Aspyr (Linux)","game","2K<br/>Aspyr (Mac)<br/>Aspyr (Linux)"
"true",,"GBP",,"true",0,"https://steamcdn-a.akamaihd.net/steam/apps/736190/header.jpg?t=1539687952","Minimum:<br>&emsp;OS: XP, Vista, 7, 8, 10<br>&emsp;Processor: Intel Pentium III 800 MHz+<br>&emsp;Memory: 2 GB RAM<br>&emsp;Graphics: 1024x768 High Color +<br>&emsp;DirectX: Version 9.0<br>&emsp;Storage: 500 MB available space",3582,,"false",719,736190,719,0,"false",5200,"中国式家长 / Chinese Parents",,"false","28 Sep, 2018",,,"Minimum:<br>&emsp;OS: Snow Leopard 10.6<br>&emsp;Processor: 2.0GHz+ 64-bit<br>&emsp;Memory: 1 GB RAM<br>&emsp;Storage: 500 MB available space","墨鱼玩游戏","game","Coconut Island Games"
"true",,"GBP",,"true",0,"https://steamcdn-a.akamaihd.net/steam/apps/447020/header.jpg?t=1537464471","Minimum:<br>&emsp;OS: Windows 7, Windows 8, Windows 10<br>&emsp;Processor: 2.0 GHz Intel or equivalent AMD dual-core processor<br>&emsp;Memory: 2 GB RAM<br>&emsp;Graphics: Nvidia Geforce GTS 450 Series, AMD Radeon HD 6770 graphics card or better (min 1GB VRAM)<br>&emsp;Network: Broadband Internet connection<br>&emsp;Storage: 6 GB available space<br>&emsp;Additional Notes: INTERNET CONNECTION REQUIRED FOR THE ONLINE GAME",4490,,"false",1999,447020,1999,0,"false",9996,"Farming Simulator 17",69,"false","24 Oct, 2016",,"https://www.metacritic.com/game/pc/farming-simulator-17?ftag=MCD-06-10aaa1f","Minimum:<br>&emsp;OS: Mac OS X  10.9.1, 10.10.1, 10.11.1 or 10.12.1<br>&emsp;Processor: 2.0 GHz dual-core processor or better<br>&emsp;Memory: 2 GB RAM<br>&emsp;Graphics: Nvidia Geforce GTS 450 Series, AMD Radeon HD 6770 or better (min 1GB VRAM)<br>&emsp;Network: Broadband Internet connection<br>&emsp;Storage: 6 GB available space<br>&emsp;Additional Notes: INTERNET CONNECTION REQUIRED FOR THE ONLINE GAME","Giants Software","game","Focus Home Interactive"
"false",,"GBP",,"true",17,"https://steamcdn-a.akamaihd.net/steam/apps/22380/header.jpg?t=1533678449","&emsp;OS: Windows 7/Vista/XP <br>								&emsp;Processor: Dual Core 2.0GHz<br>								&emsp;Memory: 2GB RAM<br>								&emsp;Hard Disk Space: 10GB free space<br>								&emsp;Video Card: NVIDIA GeForce 6 series, ATI 1300XT series<br>								",2460,,"false",799,22380,799,0,"false",46987,"Fallout: New Vegas",84,"false","21 Oct, 2010",,"https://www.metacritic.com/game/pc/fallout-new-vegas?ftag=MCD-06-10aaa1f",,"Obsidian Entertainment","game","Bethesda Softworks"
"false","Recommended:<br>&emsp;Requires a 64-bit processor and operating system<br>&emsp;OS: Windows 7, 8.1, 10 (64-bit)<br>&emsp;Processor: Intel Core i5-4690 3.5 GHz or equivalent<br>&emsp;Memory: 8 GB RAM<br>&emsp;Graphics: GeForce GTX 1060 or equivalent<br>&emsp;DirectX: Version 11<br>&emsp;Storage: 20 GB available space<br>&emsp;Sound Card: DirectX compatible soundcard or onboard chipset","GBP","Recommended:<br>&emsp;Requires a 64-bit processor and operating system","true",0,"https://steamcdn-a.akamaihd.net/steam/apps/544750/header.jpg?t=1540390529","Minimum:<br>&emsp;Requires a 64-bit processor and operating system<br>&emsp;OS: Windows 7, 8.1, 10 (64-bit)<br>&emsp;Processor: Intel Core i3-4160 @ 3.60GHz or equivalent<br>&emsp;Memory: 6 GB RAM<br>&emsp;Graphics: NVIDIA GeForce GTX 1050<br>&emsp;DirectX: Version 11<br>&emsp;Storage: 20 GB available space<br>&emsp;Sound Card: DirectX compatible soundcard or onboard chipset",1952,"Minimum:<br>&emsp;Requires a 64-bit processor and operating system","false",4999,544750,4999,0,"false",1245,"SOULCALIBUR VI",81,"false","18 Oct, 2018","Recommended:<br>&emsp;Requires a 64-bit processor and operating system","https://www.metacritic.com/game/pc/soulcalibur-vi?ftag=MCD-06-10aaa1f","Minimum:<br>&emsp;Requires a 64-bit processor and operating system","BANDAI NAMCO Studios<br/>Dimps Corporation","game","BANDAI NAMCO Entertainment"
