platforms_mac,pc_requirements_recommended,price_overview_currency,linux_requirements_recommended,platforms_windows,required_age,header_image,pc_requirements_minimum,current_players,linux_requirements_minimum,is_free,price_overview_initial,steam_appid,price_overview_final,price_overview_discount_percent,coming_soon,recommendations_total,name,metacritic_score,platforms_linux,release_date,mac_requirements_recommended,metacritic_url,mac_requirements_minimum,developers,type,publishers
"false","Recommended:<br>								&emsp;Processor: Quad-core Intel or AMD CPU<br>								&emsp;Memory: 4GB System RAM<br>								&emsp;Video Card: DirectX 9.0c compatible NVIDIA or AMD ATI video card with 1GB of RAM (Nvidia GeForce GTX 260 or higher; ATI Radeon 4890 or higher)<br>								","GBP",,"true",15,"https://steamcdn-a.akamaihd.net/steam/apps/72850/header.jpg?t=1493767797","Minimum:<br>								&emsp;OS: Windows 7/Vista/XP PC (32 or 64 bit)<br>								&emsp;Processor: Dual Core 2.0GHz or equivalent processor<br>								&emsp;Memory: 2GB System RAM<br>								&emsp;Hard Disk Space: 6GB free HDD Space<br>								&emsp;Video Card: Direct X 9.0c compliant video card with 512 MB of RAM<br>								&emsp;Sound: DirectX compatible sound card<br>								",6611,,"false",999,72850,999,0,"false",152525,"The Elder Scrolls V: Skyrim",94,"false","10 Nov, 2011",,"https://www.metacritic.com/game/pc/the-elder-scrolls-v-skyrim?ftag=MCD-06-10aaa1f",,"Bethesda Game Studios","game","Bethesda Softworks"
"true",,"GBP",,"true",0,"https://steamcdn-a.akamaihd.net/steam/apps/646570/header.jpg?t=1530082099","Minimum:<br>&emsp;OS: Windows XP, Vista, 7, 8/8.1, 10<br>&emsp;Processor: 2.0 Ghz<br>&emsp;Memory: 4 GB RAM<br>&emsp;Graphics: 256mb Video Memory, capable of OpenGL 2.0+ support<br>&emsp;Storage: 1 GB available space",5788,"Minimum:<br>&emsp;OS: Ubuntu 14.04 LTS<br>&emsp;Processor: 2.0 Ghz<br>&emsp;Memory: 2 GB RAM<br>&emsp;Graphics: 128mb Video Memory, capable of OpenGL 3.0+ support (2.1 with ARB extensions acceptable)<br>&emsp;Storage: 1 GB available space","false",1199,646570,1199,0,"false",16700,"Slay the Spire",,"true","14 Nov, 2017",,,"Minimum:<br>&emsp;OS: OSX 10.9.5 - 10.11.6<br>&emsp;Processor: 2.0 Ghz<br>&emsp;Memory: 4 GB RAM<br>&emsp;Graphics: 256mb Video Memory, capable of OpenGL 3.0+ support (2.1 with ARB extensions acceptable)<br>&emsp;Storage: 1 GB available space","Mega Crit Games","game","Mega Crit Games"
"true","Recommended:<br>&emsp;OS:/Windows 7/Windows 8<br>	&emsp;Processor:Intel® Pentium® IV 2.4 GHz or AMD 3500+<br>	&emsp;Memory:2 GB RAM<br>	&emsp;Graphics:NVIDIA® GeForce 8800 or ATI Radeon® X1900, 1024mb video memory recommended<br>	&emsp;DirectX®:9.0c<br>	&emsp;Hard Drive:2 GB HD space<br>	&emsp;Sound:Direct X-compatible soundcard<br>	&emsp;Other Requirements:Broadband Internet connection<br>	&emsp;Additional:Controller support: 3-button mouse, keyboard and speakers. Internet Connection or LAN for multiplayer","GBP","Recommended:<br>&emsp;OS:Ubuntu 16.04 LTS<br>	&emsp;Processor:Intel Core Duo Processor (2GHz or better)<br>	&emsp;Memory:2 GB RAM<br>	&emsp;Graphics:ATI Radeon HD 6750 / NVIDIA GeForce 320 / NVIDIA GeForce 9600 or higher, 1024MB graphics memory required<br>	&emsp;Hard Drive:2 GB HD space<br>	&emsp;Other Requirements:Broadband Internet connection<br>	&emsp;Additional:GLSL 1.3, OpenGL 2.1. Controller support: 3-button mouse, keyboard and speakers. Internet Connection or LAN for multiplayer","true",0,"https://steamcdn-a.akamaihd.net/steam/apps/236850/header.jpg?t=1539939079","Minimum:<br>&emsp;OS:Windows 7/Windows 8<br>	&emsp;Processor:Intel® Pentium® IV 2.4 GHz eller AMD 3500+<br>	&emsp;Memory:2 GB RAM<br>	&emsp;Graphics:NVIDIA® GeForce 8800 or ATI Radeon® X1900, 512mb video memory required<br>	&emsp;DirectX®:9.0c<br>	&emsp;Hard Drive:2 GB HD space<br>	&emsp;Sound:Direct X- compatible soundcard <br>	&emsp;Other Requirements:Broadband Internet connection<br>	&emsp;Additional:Controller support: 3-button mouse, keyboard and speakers. Internet Connection or LAN for multiplayer",7049,"Minimum:<br>&emsp;OS:Ubuntu 16.04 LTS<br>	&emsp;Processor:Intel Core Duo Processor (2GHz or better)<br>	&emsp;Memory:2 GB RAM<br>	&emsp;Graphics:ATI Radeon HD 6750 / NVIDIA GeForce 320 / NVIDIA GeForce 9600 or higher, 1024MB graphics memory required<br>	&emsp;Hard Drive:2 GB HD space<br>	&emsp;Other Requirements:Broadband Internet connection<br>	&emsp;Additional:GLSL 1.3, OpenGL 2.1. Controller support: 3-button mouse, keyboard and speakers. Internet Connection or LAN for multiplayer","false",3499,236850,874,75,"false",30883,"Europa Universalis IV",87,"true","13 Aug, 2013","Recommended:<br>&emsp;OS:Mac OS X 10.6.8 or better<br>	&emsp;Processor:Intel Core Duo Processor (2GHz or better)<br>	&emsp;Memory:2 GB RAM<br>	&emsp;Graphics:ATI Radeon HD 6750 / NVIDIA GeForce 320 / NVIDIA GeForce 9600 or higher, 1024MB graphics memory required<br>	&emsp;Hard Drive:2 GB HD space<br>	&emsp;Other Requirements:Broadband Internet connection<br>	&emsp;Additional:GLSL 1.3, OpenGL 2.1. Controller support: 3-button mouse, keyboard and speakers. Internet Connection or LAN for multiplayer","https://www.metacritic.com/game/pc/europa-universalis-iv?ftag=MCD-06-10aaa1f","Minimum:<br>&emsp;OS:Mac OS X 10.6.8 or better<br>	&emsp;Processor:Intel Core Duo Processor (2GHz or better)<br>	&emsp;Memory:2 GB RAM<br>	&emsp;Graphics:ATI Radeon HD 6750 / NVIDIA GeForce 320 / NVIDIA GeForce 9600 or higher, 1024MB graphics memory required<br>	&emsp;Hard Drive:2 GB HD space<br>	&emsp;Other Requirements:Broadband Internet connection<br>	&emsp;Additional:GLSL 1.3, OpenGL 2.1. Controller support: 3-button mouse, keyboard and speakers. Internet Connection or LAN for multiplayer","Paradox Development Studio","game","Paradox Interactive"
"true",,"GBP",,"true",0,"https://steamcdn-a.akamaihd.net/steam/apps/10/header.jpg?t=1528733245","<br/>			Minimum: 500 mhz processor, 96mb ram, 16mb video card, Windows XP, Mouse, Keyboard, Internet Connection<br/>			Recommended: 800 mhz processor, 128mb ram, 32mb+ video card, Windows XP, Mouse, Keyboard, Internet Connection<br/>			",8307,"Minimum: Linux Ubuntu 12.04, Dual-core from Intel or AMD at 2.8 GHz, 1GB Memory, nVidia GeForce 8600/9600GT, ATI/AMD Radeaon HD2600/3600 (Graphic Drivers: nVidia 310, AMD 12.11), OpenGL 2.1, 4GB Hard Drive Space, OpenAL Compatible Sound Card","false",719,10,719,0,"false",58911,"Counter-Strike",88,"true","1 Nov, 2000",,"https://www.metacritic.com/game/pc/counter-strike?ftag=MCD-06-10aaa1f","Minimum: OS X  Snow Leopard 10.6.3, 1GB RAM, 4GB Hard Drive Space,NVIDIA GeForce 8 or higher, ATI X1600 or higher, or Intel HD 3000 or higher Mouse, Keyboard, Internet Connection","Valve","game","Valve"
"false",,,,"true",0,"https://steamcdn-a.akamaihd.net/steam/apps/438100/header.jpg?t=1515998953","Minimum:<br>&emsp;OS: Windows 7, Windows 8.1, Windows 10<br>&emsp;Processor: Intel® i5-4590 / AMD FX 8350 equivalent or greater<br>&emsp;Memory: 4 GB RAM<br>&emsp;Graphics: NVIDIA GeForce® GTX 970 / AMD Radeon™ R9 290 equivalent or greater<br>&emsp;DirectX: Version 11<br>&emsp;Network: Broadband Internet connection<br>&emsp;Storage: 1 GB available space",4619,,"true",,438100,,,"false",169,"VRChat",,"false","1 Feb, 2017",,,,"VRChat Inc.","game","VRChat Inc."
"false","Recommended:<br>&emsp;OS: Windows7 (64bit)<br>&emsp;Processor: Intel Core i5-3320<br>&emsp;Memory: 4 GB RAM<br>&emsp;Graphics: NVIDIA GeFore GTX970<br>&emsp;DirectX: Version 11<br>&emsp;Network: Broadband Internet connection<br>&emsp;Storage: 8 GB available space<br>&emsp;Sound Card: On Board<br>&emsp;Additional Notes: 1920 x 1080 monitor resolution",,,"true",0,"https://steamcdn-a.akamaihd.net/steam/apps/601510/header.jpg?t=1537848730","Minimum:<br>&emsp;OS: Windows7 (64bit)<br>&emsp;Processor: Intel Core i3-3210<br>&emsp;Memory: 2 GB RAM<br>&emsp;Graphics: Intel(R) HD Graphics 4000<br>&emsp;DirectX: Version 11<br>&emsp;Network: Broadband Internet connection<br>&emsp;Storage: 4 GB available space<br>&emsp;Sound Card: On Board<br>&emsp;Additional Notes: 1280 x 720 monitor resolution",4658,,"true",,601510,,,"false",,"Yu-Gi-Oh! Duel Links",,"false","16 Nov, 2017",,,,"Konami Digital Entertainment","game","Konami Digital Entertainment"
"true",,,,"true",0,"https://steamcdn-a.akamaihd.net/steam/apps/627690/header_alt_assets_0.jpg?t=1540401827","Minimum:<br>&emsp;OS: Microsoft® Windows Server 2008, Windows 7, or Windows 8 Classic<br>&emsp;Processor: 2.33GHz or faster x86-compatible processor, or Intel Atom™ 1.6GHz or faster processor for netbook class devices<br>&emsp;Memory: 512 MB RAM<br>&emsp;Storage: 120 MB available space<br>&emsp;Additional Notes: 120 MB available space",5009,,"true",,627690,,,"false",,"Idle Champions of the Forgotten Realms",,"false","7 Sep, 2017",,,"Minimum:<br>&emsp;OS: Mac OS X v10.6, and above<br>&emsp;Processor: Intel® Core™ Duo 1.83GHz or faster processor<br>&emsp;Memory: 512 MB RAM<br>&emsp;Storage: 120 MB available space","Codename Entertainment Inc.","game","Codename Entertainment Inc."
"true","Recommended:<br>&emsp;OS: Windows 7 x64 or newer<br>&emsp;Processor: AMD Phenom II X4 850 @ 3.3 Ghz or Intel i3 2100 @ 3.1 Ghz<br>&emsp;Memory: 4 GB RAM<br>&emsp;Graphics: AMD HD 6850 / or Nvidia GTX 560TI, with 1024MB VRAM<br>&emsp;DirectX: Version 9.0c<br>&emsp;Storage: 4 GB available space<br>&emsp;Sound Card: DirectX 9.0c-compatible sound card<br>&emsp;Additional Notes: Controller support: 3-button mouse, keyboard and speakers. Special multiplayer requirements: Internet Connection or LAN for multiplayer.","GBP","Recommended:<br>&emsp;OS: Ubuntu 16.04 x64<br>&emsp;Processor: AMD Phenom II X4 850 @ 3.3 Ghz / or Intel i3 2100 @ 3.1 Ghz<br>&emsp;Memory: 4 GB RAM<br>&emsp;Graphics: AMD HD 6850 / or Nvidia GTX 560TI, with 1024MB VRAM (Latest available proprietary drivers from both manufacturers)<br>&emsp;Storage: 4 GB available space<br>&emsp;Additional Notes: Controller support: 3-button mouse, keyboard and speakers. Special multiplayer requirements: Internet Connection or LAN for multiplayer.","true",0,"https://steamcdn-a.akamaihd.net/steam/apps/281990/header.jpg?t=1540393688","Minimum:<br>&emsp;OS: Windows 7 x86 or newer<br>&emsp;Processor: AMD Athlon II X4 640 @ 3.0 Ghz / or Intel Core 2 Quad 9400 @ 2.66 Ghz<br>&emsp;Memory: 2 GB RAM<br>&emsp;Graphics: AMD HD 5770 / or Nvidia GTX 460, with 1024MB VRAM. Latest available WHQL drivers from both manufacturers.<br>&emsp;DirectX: Version 9.0c<br>&emsp;Network: Broadband Internet connection<br>&emsp;Storage: 4 GB available space<br>&emsp;Sound Card: Direct X 9.0c- compatible sound card<br>&emsp;Additional Notes: Controller support: 3-button mouse, keyboard and speakers. Special multiplayer requirements: Internet Connection or LAN for multiplayer.",5027,"Minimum:<br>&emsp;OS: Ubuntu 16.04 x86<br>&emsp;Processor: AMD Athlon II X4 640 @ 3.0 Ghz / or Intel Core 2 Quad 9400 @ 2.66 Ghz<br>&emsp;Memory: 2 GB RAM<br>&emsp;Graphics: AMD HD 5770 / or Nvidia GTX 460, with 1024MB VRAM. Latest available proprietary drivers from both manufacturers.<br>&emsp;Storage: 4 GB available space<br>&emsp;Additional Notes: Controller support: 3-button mouse, keyboard and speakers. Special multiplayer requirements: Internet Connection or LAN for multiplayer.","false",3499,281990,1399,60,"false",27335,"Stellaris",78,"true","9 May, 2016","Recommended:<br>&emsp;OS: OS X 10.11 or newer<br>&emsp;Processor: Intel Core i5 @ 2.9Ghz<br>&emsp;Memory: 4 GB RAM<br>&emsp;Graphics: Nvidia GTX 750M / or AMD R9 390M with 1024 VRAM<br>&emsp;Storage: 4 GB available space<br>&emsp;Additional Notes: Controller support: 3-button mouse, keyboard and speakers. Special multiplayer requirements: Internet Connection or LAN for multiplayer","https://www.metacritic.com/game/pc/stellaris?ftag=MCD-06-10aaa1f","Minimum:<br>&emsp;OS: OS X 10.8.5 or newer<br>&emsp;Processor: Intel Core i5 @ 2.5Ghz<br>&emsp;Memory: 4 GB RAM<br>&emsp;Graphics: ATI Radeon HD 6750 / NVIDIA GeForce 320 or higher with 1024MB VRAM<br>&emsp;Storage: 4 GB available space<br>&emsp;Additional Notes: Controller support: 3-button mouse, keyboard and speakers. Special multiplayer requirements: Internet Connection or LAN for multiplayer.","Paradox Development Studio","game","Paradox Interactive"
"true","Recommended:<br>&emsp;OS: Windows 7 or higher<br>&emsp;Processor: 3.0 Ghz Quad Core CPU or faster<br>&emsp;Memory: 12 GB RAM<br>&emsp;Graphics: 2 GB Dedicated Memory<br>&emsp;DirectX: Version 10<br>&emsp;Network: Broadband Internet connection<br>&emsp;Storage: 4 GB available space<br>&emsp;Sound Card: Sound Card: DirectX® Compatible<br>&emsp;Additional Notes: Running the Dedicated Server and Client on the same computer will double ram requirements. Also future releases may require more hard drive space.","GBP","Recommended:<br>&emsp;OS: Ubuntu 14.04<br>&emsp;Processor: 3.0 Ghz Quad Core CPU or faster<br>&emsp;Memory: 12 GB RAM<br>&emsp;Graphics: 2 GB Dedicated Memory<br>&emsp;Network: Broadband Internet connection<br>&emsp;Storage: 4 GB available space<br>&emsp;Additional Notes: Running the Dedicated Server and Client on the same computer will double ram requirements. Also future releases may require more hard drive space.","true",0,"https://steamcdn-a.akamaihd.net/steam/apps/251570/header.jpg?t=1502044027","Minimum:<br>&emsp;OS: WindowsXP (Service Pack 3)<br>&emsp;Processor: 2.4 Ghz Dual Core CPU<br>&emsp;Memory: 6 GB RAM<br>&emsp;Graphics: 1 GB Dedicated Memory<br>&emsp;DirectX: Version 10<br>&emsp;Network: Broadband Internet connection<br>&emsp;Storage: 4 GB available space<br>&emsp;Sound Card: Sound Card: DirectX® Compatible<br>&emsp;Additional Notes: Running the Dedicated Server and Client on the same computer will double ram requirements. Also future releases may require more hard drive space.",4473,"Minimum:<br>&emsp;OS: Ubuntu 12.04<br>&emsp;Processor: 2.4 Ghz Dual Core CPU<br>&emsp;Memory: 6 GB RAM<br>&emsp;Graphics: 1 GB Dedicated Memory<br>&emsp;Network: Broadband Internet connection<br>&emsp;Storage: 4 GB available space<br>&emsp;Additional Notes: Running the Dedicated Server and Client on the same computer will double ram requirements. Also future releases may require more hard drive space.","false",1899,251570,683,64,"false",48518,"7 Days to Die",,"true","13 Dec, 2013","Recommended:<br>&emsp;OS: 10.9<br>&emsp;Processor: 3.0 Ghz Quad Core CPU or faster<br>&emsp;Memory: 12 GB RAM<br>&emsp;Graphics: 2 GB Dedicated Memory<br>&emsp;Network: Broadband Internet connection<br>&emsp;Storage: 4 GB available space<br>&emsp;Additional Notes: Running the Dedicated Server and Client on the same computer will double ram requirements. Also future releases may require more hard drive space.",,"Minimum:<br>&emsp;OS: 10.7<br>&emsp;Processor: 2.4 Ghz Dual Core CPU<br>&emsp;Memory: 6 GB RAM<br>&emsp;Graphics: 1 GB Dedicated Memory<br>&emsp;Network: Broadband Internet connection<br>&emsp;Storage: 4 GB available space<br>&emsp;Additional Notes: Running the Dedicated Server and Client on the same computer will double ram requirements. Also future releases may require more hard drive space.","The Fun Pimps","game","The Fun Pimps Entertainment LLC"
"false","Recommended:<br>&emsp;Requires a 64-bit processor and operating system<br>&emsp;OS: Windows 7 SP1 64-bit or Windows 8.1 64-bit or Windows 10 64-bit<br>&emsp;Processor: Intel Core i7 or equivalent<br>&emsp;Memory: 8 GB RAM<br>&emsp;Graphics: NVIDIA GeForce GTX 770 or AMD R9 280<br>&emsp;DirectX: Version 11<br>&emsp;Storage: 60 GB available space<br>&emsp;Additional Notes: Recommended requirements may change during development.","GBP","Recommended:<br>&emsp;Requires a 64-bit processor and operating system","true",0,"https://steamcdn-a.akamaihd.net/steam/apps/435150/header.jpg?t=1539352146","Minimum:<br>&emsp;Requires a 64-bit processor and operating system<br>&emsp;OS: Windows 7 SP1 64-bit or Windows 8.1 64-bit or Windows 10 64-bit<br>&emsp;Processor: Intel Core i5 or equivalent<br>&emsp;Memory: 4 GB RAM<br>&emsp;Graphics: NVIDIA® GeForce® GTX 550 or ATI™ Radeon™ HD 6XXX or higher<br>&emsp;DirectX: Version 11<br>&emsp;Storage: 60 GB available space<br>&emsp;Additional Notes: Minimum requirements may change during development.",4064,"Minimum:<br>&emsp;Requires a 64-bit processor and operating system","false",2999,435150,2009,33,"false",30487,"Divinity: Original Sin 2 - Definitive Edition",93,"false","14 Sep, 2017","Recommended:<br>&emsp;Requires a 64-bit processor and operating system","https://www.metacritic.com/game/pc/divinity-original-sin-ii?ftag=MCD-06-10aaa1f","Minimum:<br>&emsp;Requires a 64-bit processor and operating system","Larian Studios","game","Larian Studios"
"true","Recommended:<br>&emsp;OS: Windows 10, 8, 7 (64 Bit)<br>&emsp;Processor: Quad core 3Ghz+<br>&emsp;Memory: 8 GB RAM<br>&emsp;Graphics: 2GB Video memory<br>&emsp;Storage: 1 GB available space","GBP","Recommended:<br>&emsp;OS: Linux (tarball installation)<br>&emsp;Processor: Quad core 3GHz+<br>&emsp;Memory: 8 GB RAM<br>&emsp;Graphics: 2GB Video memory<br>&emsp;Storage: 1 GB available space","true",0,"https://steamcdn-a.akamaihd.net/steam/apps/427520/header.jpg?t=1530541487","Minimum:<br>&emsp;OS: Windows 10, 8, 7, Vista (64 Bit)<br>&emsp;Processor: Dual core 3Ghz+<br>&emsp;Memory: 4 GB RAM<br>&emsp;Graphics: 512MB Video Memory<br>&emsp;Storage: 1 GB available space<br>&emsp;Additional Notes: Low sprite resolution and Low VRAM usage.",4593,"Minimum:<br>&emsp;OS: Linux (tarball installation)<br>&emsp;Processor: Dual core 3Ghz+<br>&emsp;Memory: 4 GB RAM<br>&emsp;Graphics: 512MB Video Memory<br>&emsp;Storage: 1 GB available space<br>&emsp;Additional Notes: Low sprite resolution and Low VRAM usage","false",2100,427520,2100,0,"false",30372,"Factorio",,"true","25 Feb, 2016","Recommended:<br>&emsp;OS: macOS High Sierra, Sierra, OSX El Capitan, Yosemite, Mavericks<br>&emsp;Processor: Quad core 3GHz+<br>&emsp;Memory: 8 GB RAM<br>&emsp;Graphics: 2GB Video memory<br>&emsp;Storage: 1 GB available space",,"Minimum:<br>&emsp;OS: macOS High Sierra, Sierra, OSX El Capitan, Yosemite, Mavericks<br>&emsp;Processor: Dual core 3Ghz+<br>&emsp;Memory: 4 GB RAM<br>&emsp;Graphics: 512MB Video Memory<br>&emsp;Storage: 1 GB available space<br>&emsp;Additional Notes: Low sprite resolution and Low VRAM usage","Wube Software LTD.","game","Wube Software LTD."
"false","Recommended:<br>&emsp;Additional:900x600 minimum display resolution","GBP",,"true",0,"https://steamcdn-a.akamaihd.net/steam/apps/221380/header.jpg?t=1534437316","Minimum:<br>&emsp;OS:Windows Vista, 7, 8 Pro+<br>	&emsp;Processor:1.2GHZ CPU<br>	&emsp;Memory:1 GB RAM<br>	&emsp;Graphics:Direct X 9.0c Capable GPU<br>	&emsp;DirectX®:9.0c<br>	&emsp;Hard Drive:2 GB HD space",4350,,"false",1499,221380,1499,0,"false",40773,"Age of Empires II HD",68,"false","9 Apr, 2013",,"https://www.metacritic.com/game/pc/age-of-empires-ii-hd-edition?ftag=MCD-06-10aaa1f",,"Skybox Labs<br/>Hidden Path Entertainment<br/>Ensemble Studios<br/>Forgotten Empires","game","Microsoft Studios"
"false","Recommended:<br>&emsp;OS: Windows 7 SP1 64bit, Windows 8.1 64bit Windows 10 64bit<br>&emsp;Processor: Intel Core i7-3770 / AMD® FX-8350<br>&emsp;Memory: 8 GB RAM<br>&emsp;Graphics: NVIDIA® GeForce GTX 970 / ATI Radeon R9 series<br>&emsp;DirectX: Version 11<br>&emsp;Network: Broadband Internet connection<br>&emsp;Storage: 25 GB available space<br>&emsp;Sound Card: DirectX 11 sound device<br>&emsp;Additional Notes: Internet connection required for online play and product activation","GBP",,"true",0,"https://steamcdn-a.akamaihd.net/steam/apps/374320/header.jpg?t=1538593076","Minimum:<br>&emsp;OS: Windows 7 SP1 64bit, Windows 8.1 64bit Windows 10 64bit<br>&emsp;Processor: Intel Core i3-2100 / AMD® FX-6300<br>&emsp;Memory: 4 GB RAM<br>&emsp;Graphics: NVIDIA® GeForce GTX 750 Ti / ATI Radeon HD 7950<br>&emsp;DirectX: Version 11<br>&emsp;Network: Broadband Internet connection<br>&emsp;Storage: 25 GB available space<br>&emsp;Sound Card: DirectX 11 sound device<br>&emsp;Additional Notes: Internet connection required for online play and product activation",4863,,"false",3999,374320,999,75,"false",59361,"DARK SOULS™ III",89,"false","11 Apr, 2016",,"https://www.metacritic.com/game/pc/dark-souls-iii?ftag=MCD-06-10aaa1f",,"FromSoftware, Inc.","game","FromSoftware, Inc.<br/>BANDAI NAMCO Entertainment"
"false","Recommended:<br>&emsp;OS: Windows® 7 64 bit, Windows® 8.1 64 bit, Windows® 10 64 bit<br>&emsp;Processor: Intel® Core™i7 3GHz or higher<br>&emsp;Memory: 8 GB RAM<br>&emsp;Graphics: 1920 x 1080: NVIDIA® Geforce® GTX970 or higher AMD Radeon™ RX 480 or higher<br>&emsp;DirectX: Version 11<br>&emsp;Network: Broadband Internet connection<br>&emsp;Storage: 60 GB available space<br>&emsp;Sound Card: DirectSound® sound card (DirectX® 9.0c or higher)<br>&emsp;Additional Notes: System Requirements may be subject to change. If you are using a router, please set up your ports so that the below packets can pass through. [Ports that may be used] TCP：80, 443, 54992～54994, 55006～55007, 55021～55040","GBP",,"true",16,"https://steamcdn-a.akamaihd.net/steam/apps/39210/header.jpg?t=1534886464","Minimum:<br>&emsp;OS: Windows® 7 32/64 bit, Windows® 8.1 32/64 bit, Windows® 10 32/64 bit<br>&emsp;Processor: Intel® Core™i5 2.4GHz or higher<br>&emsp;Memory: 3 GB RAM<br>&emsp;Graphics: 1280 x 720: NVIDIA® Geforce® GTX750 or higher, AMD Radeon™ R7 260X or higher<br>&emsp;DirectX: Version 9.0c<br>&emsp;Network: Broadband Internet connection<br>&emsp;Storage: 60 GB available space<br>&emsp;Sound Card: DirectSound® sound card (DirectX® 9.0c or higher)<br>&emsp;Additional Notes: System Requirements may be subject to change. If you are using a router, please set up your ports so that the below packets can pass through. [Ports that may be used] TCP：80, 443, 54992～54994, 55006～55007, 55021～55040",3118,,"false",999,39210,999,0,"false",9345,"FINAL FANTASY XIV Online",83,"false","18 Feb, 2014",,"https://www.metacritic.com/game/pc/final-fantasy-xiv-online-a-realm-reborn?ftag=MCD-06-10aaa1f",,"Square Enix","game","Square Enix"
,,,,,,,,5555,,,,,,,,,,,,,,,,,,
"false",,"GBP",,"true",0,"https://steamcdn-a.akamaihd.net/steam/apps/47890/header.jpg?t=1523572246","&emsp;OS: Windows XP (Service Pack 2) or Windows Vista (Service Pack 1)<br>	&emsp;Processor: (XP) 2.0 GHz P4 processor or equivalent; (Vista) 2.4 GHz P4 processor or equivalent <br>	&emsp;Memory: (XP) 1 GB; (Vista) 1.5 GB<br>	&emsp;Graphics: 128 MB Video Card with support for Pixel Shader 2.0<br> 	&emsp;DirectX®: <br>	&emsp;Hard Drive: At least 6.5 GB of hard drive space with at least 1 GB additional space for custom content<br>	&emsp;Sound:<br>	&emsp;Built-in Graphics:&emsp;Intel Integrated Chipset, GMA X3000 or above. <br> 	&emsp;2.6 GHz Pentium D CPU, or 1.8 GHz Core 2 Duo, or equivalent <br> 	&emsp;0.5 GB additional RAM&emsp;Supported Video Cards:Nvidia GeForce series: FX5900 or greater, G100, GT 120, GT 130, GTS 150, GTS 250, GTX 260, GTX 275, GTX 280, GTX 285, GTX 295; ATI Radeon™ series: ATI Radeon 9500 series of greater, X300, X600, X700, X800, X850, X1300, X1600, X1800, X1900, X1950, 2400, 2600, 2900, 3450, 3650, 3850, 3870, 4850, 4870 series or greater; Intel® Graphics Media Accelerator (GMA): GMA 3-Series, GMA 4-Series <br>	&emsp;*Please note that the GeForce 6100 and 7100 cards are not supported",3513,,"false",2499,47890,624,75,"false",11532,"The Sims™ 3",86,"false","27 Jan, 2011",,"https://www.metacritic.com/game/pc/the-sims-3?ftag=MCD-06-10aaa1f",,"The Sims Studio","game","Electronic Arts"
